"b'Republicans are very unified and energized in our fight on the Impeachment Hoax with the Do Nothing Democrats, and\xe2\x80\xa6 t.co/oO6ZAoZwTm'"
b't.co/FXSdXJjLS2'
b'-Cuts Oversight and Foreign Affairs out of public hearings-Pretends to give DevinNunes sub\xe2\x80\xa6'
b'Nervous Nancy Pelosi is doing everything possible to destroy the Republican Party. Our Polls show that it is going\xe2\x80\xa6 t.co/NZhRErLWB7'
b'\xe2\x80\x9cOver in Europe and Japan they have NEGATIVE RATES. They get paid to borrow money. Don\xe2\x80\x99t we have to follow our comp\xe2\x80\xa6 t.co/p8WvPNmPlY'
b'Consumer Confidence number very good. Housing sales in September up nicely. Economy Rocks!'
"b'A great new book just out, \xe2\x80\x9cThe Plot Against the President. The True Story Of How Congressman Devin Nunez Uncovered\xe2\x80\xa6 t.co/G4qCRh2j5H'"
b'Just confirmed that Abu Bakr al-Baghdadi\xe2\x80\x99s number one replacement has been terminated by American troops. Most like\xe2\x80\xa6 t.co/0sNAkHdVIS'
"b'95% Approval Rating in the Republican Party, a record. Thank you!'"
"b'Supposedly, according to the Corrupt Media, the Ukraine call \xe2\x80\x9cconcerned\xe2\x80\x9d today\xe2\x80\x99s Never Trumper witness. Was he on t\xe2\x80\xa6 t.co/AwzEEM8SVq'"
b'How many more Never Trumpers will be allowed to testify about a perfectly appropriate phone call when all anyone ha\xe2\x80\xa6 t.co/PgaZwgGPde'
"b'The Do Nothing Democrats are working hard to make everyone forget the Best Economy Ever, the monumental weekend rai\xe2\x80\xa6 t.co/QMkTLXprao'"
"b'Where\xe2\x80\x99s the Whistleblower? Just read the Transcript, everything else is made up garbage by Shifty Schiff and the Never Trumpers!'"
b'- No aid\xe2\x80\xa6'
b'Th\xe2\x80\xa6'
b'Now she wants a v\xe2\x80\xa6'
b'A great book by a great guy. Get it now! t.co/hwFtbpbIO0'
"b'Correct, a total scam! t.co/klpmeAwm03'"
b'Codifying a sham process halfway through doesn\xe2\x80\x99t ma\xe2\x80\xa6'
"b""Only Schiff's\xe2\x80\xa6"""
b'Why are people that I never even heard of testifying about the call. Just READ THE CALL TRANSCRIPT AND THE IMPEACHM\xe2\x80\xa6 t.co/3EP3qUxRva'
b't.co/r9tZoxRUYa'
"b'\xe2\x80\x9cThis is a big win for America, and also for President Trump.\xe2\x80\x9d nypost'"
"b'The only crimes in the Impeachment Hoax were committed by Shifty Adam Schiff, when he totally made up my phone conv\xe2\x80\xa6 t.co/l23U6f8kqT'"
"b'\xe2\x80\x9cThere is no underlying crime in that transcript.\xe2\x80\x9d IngrahamAngle 100% correct, and the Whistleblower disappeared\xe2\x80\xa6 t.co/31oZPvOevx'"
b'\xe2\x80\x9cAmericans know by now that the Impeachment inquiry is just another hoax and silent coup to remove the President fr\xe2\x80\xa6 t.co/2B1Urjt6QK'
"b'Can you believe that Shifty Adam Schiff, the biggest leaker in D.C., and a corrupt politician, is upset that we did\xe2\x80\xa6 t.co/oZdlO1VB91'"
b' Today\xe2\x80\x99s backtracking is an admission t\xe2\x80\xa6'
"b'""Page didn\'t recall whether she\xe2\x80\xa6'"
b'realDonaldTrump t.co/L4x4udy63J'
"b'So nice, thank you! t.co/UjgDeHSK7C'"
"b""\xe2\x80\xa2 No pressureJim_Jordan andamp; RepMarkMeadows agree that it's time for RepAdamSchiff's cha\xe2\x80\xa6"""
b'We have declassified a picture of the wonderful dog (name not declassified) that did such a GREAT JOB in capturing\xe2\x80\xa6 t.co/w4zmC1vKD0'
b'An AMAZING CHAMPION. Great going Tiger! TigerWoods t.co/GdmcpMG42s'
b'THANK YOU t.co/iUr5OpgT7X'
"b'The Sandamp;P just hit an ALL TIME HIGH. This is a big win for jobs, 401-K\xe2\x80\x99s, and, frankly, EVERYONE! Our Country is doin\xe2\x80\xa6 t.co/tOBGRIUriL'"
b't.co/7esnNSoa5D'
b't.co/yJ0VKdNxHP'
"b'As Diwali commences, FLOTUS Melania and I wish those observing the Festival of Lights a blessed and happy celebrat\xe2\x80\xa6 t.co/Yq6VFhNW9W'"
b'Something very big has just happened!'
"b'....Matt has my Complete and Total Endorsement, and always has. GET OUT and VOTE on November 5th for your GREAT Governor, MattBevin!'"
b'Governor MattBevin has done a wonderful job for the people of Kentucky! He continues to protect your very importan\xe2\x80\xa6 t.co/MZPbpRrjYW'
"b'....He loves our Military and supports our Vets! Democrat Jim Hood will never give us his vote, is anti-Trump and p\xe2\x80\xa6 t.co/362XJb1I5f'"
b'MISSISSIPPI! There is a VERY important election for Governor on November 5th. I need you to get out and VOTE for ou\xe2\x80\xa6 t.co/GBVkuAzSCQ'
b'....Our Republican candidate EddieRispone is a successful conservative businessman who will stand with me to creat\xe2\x80\xa6 t.co/xEqqGIXgdB'
b'LOUISIANA! Extreme Democrat John Bel Edwards has sided with Nancy Pelosi and Chuck Schumer to support Sanctuary Cit\xe2\x80\xa6 t.co/WBQPQ8BNM6'
b'Where\xe2\x80\x99s the Whistleblower?'
"b'The Fake Washington Post keeps doing phony stories, with zero sources, that I am concerned with the Impeachment sca\xe2\x80\xa6 t.co/rP5LCKrYV6'"
b'My Administration is fighting hard to end the Opioid Crisis. Join with us by disposing unused or expired prescripti\xe2\x80\xa6 t.co/Ab5aWQocbB'
b'....'
"b'....greatly help the African American community (and all other communities), and which was unable to get done in pa\xe2\x80\xa6 t.co/YyLJdoDkk3'"
b'Badly failing presidential candidate KamalaHarris will not go to a very wonderful largely African American event t\xe2\x80\xa6 t.co/ceOmQgaYR5'
b'The Ukraine investigation is just as Corrupt and Fake as all of the other garbage that went on before it. Even Shif\xe2\x80\xa6 t.co/EZZjbFpf3G'
b'....We should all work together to clean up these hazardous waste and homeless sites before the whole city rots awa\xe2\x80\xa6 t.co/adJFCxhL1V'
b'I can\xe2\x80\x99t believe that Nancy Pelosi\xe2\x80\x99s District in San Francisco is in such horrible shape that the City itself is in\xe2\x80\xa6 t.co/tjvT'
"b'\xe2\x80\x9cNot a single American citizen has been charged with anything related to Russian Collusion, not one person.\xe2\x80\x9d\xe2\x80\xa6 t.co/HJkto97tHA'"
b'Had a beautiful dinner last night at Camp David in celebration of the 10th Wedding Anniversary of Ivanka and Jared.\xe2\x80\xa6 t.co/TACGmp3V2O'
"b'If true, this\xe2\x80\xa6'"
b'...Thank you foxandfriends! Hopefully this is just the beginning of a massive story of injustice and treason. You\xe2\x80\xa6 t.co/O3wRvfsopV'
b'..the President when Flynn had been cleared of everything long before that. The DOJ is withholding a lot of evidenc\xe2\x80\xa6 t.co/jHK1pwNXZ1'
b'....They exonerated him completely of being an agent of Russia (Recently Crooked Hillary charged Tulsi Gabbard andamp; Ji\xe2\x80\xa6 t.co/C4LYlGjclC'
b'\xe2\x80\x9cGeneral Michael Flynn\xe2\x80\x99s attorney is demanding that charges be immediately dropped after they found that FBI Agents\xe2\x80\xa6 t.co/oEgp1EK2PU'
b'My Administration is fighting hard to end the Opioid Crisis. Join with us by disposing unused or expired prescripti\xe2\x80\xa6 t.co/aYVYG0Vpzd'
b't.co/o6mk8orgrC t.co/iUD808JXyt'
b'Now we hear that the FBI may have altered the 302s fro\xe2\x80\xa6'
b't.co/zDEOQfpvk1 t.co/Bxpt7nQTjG'
b'Great Book! t.co/HYO77j6KRT'
b'Wow! t.co/lF3WUjiqHs'
b't.co/whO7qmrkB7'
b'My lawyers should sue the Democrats and Shifty Adam Schiff for fraud!'
"b'....The entire Impeachment Scam was based on my perfect Ukrainian call, and the Whistleblowers account of that call\xe2\x80\xa6 t.co/WVyP8LPvD2'"
b'Democrats just announced that they no longer want the Whistleblower to testify. But everything was about the Whistl\xe2\x80\xa6 t.co/821IaDY218'
b'To Tim: The Button on the IPhone was FAR better than the Swipe!'
b'....in the basement of the United States Capitol! They cannot win at the ballot box. Their sham for the past 3 year\xe2\x80\xa6 t.co/EQug5xRXB4'
"b'I appreciate the support of Senator LindseyGraham, SenateMajLdr Mitch McConnell, and their Great Senate Republica\xe2\x80\xa6 t.co/DsoS6PUsqu'"
b'-DOJ Criminal InvestigationClapper/Brennan-Comey leaking memo-Schiff corroborated\xe2\x80\xa6'
b' t.co/LtrHaz\xe2\x80\xa6'
b' LindseyGrahamSC is rig\xe2\x80\xa6'
b'It was my great honor to deliver the keynote address at the 2019 Second Step Presidential Justice Forum hosted by t\xe2\x80\xa6 t.co/me0S4pquQ1'
b'Thank you robertjeffress! t.co/o6mk8orgrC'
b'At the sa\xe2\x80\xa6'
b'Heading to South Carolina! t.co/CORtaPJq9p'
"b'\xe2\x80\x9cDonald J. Trump is an absolutely historic President already, in less than 3 years in office. His record is there f\xe2\x80\xa6 t.co/VPWZaQDqm2'"
b'....COMING HOME! We were supposed to be there for 30 days - That was 10 years ago. When these pundit fools who have\xe2\x80\xa6 t.co/fTCYGDLHad'
b'....USA has gained Trillions of Dollars in wealth since November 2016. All others way down. Our power is Economic b\xe2\x80\xa6 t.co/B3uVPzcK1U'
b'Turkey fully understands not to fire on the Kurds as they leave what will be known as the Safe Zone for other fairl\xe2\x80\xa6 t.co/ePqnDeWeuW'
"b'So Congressman Tim Ryan of Ohio has finally dropped out of the race for President, registering ZERO in the polls andamp;\xe2\x80\xa6 t.co/dfkEl9M7ro'"
"b'Another big dropout of the Presidential race was, along with 0% Tim Ryan, 0% RepSwalwell. Such talk and bravado fr\xe2\x80\xa6 t.co/iUkfqnNkOW'"
b'Pelosi violates House rules and her majority gives her a free pass.Schiff\xe2\x80\xa6'
"b'Where is the Whistleblower, and why did he or she write such a fictitious and incorrect account of my phone call wi\xe2\x80\xa6 t.co/PTDlxPPb9O'"
"b'I really enjoyed my conversation with General MazloumAbdi. He appreciates what we have done, and I appreciate what\xe2\x80\xa6 t.co/oHGABe2ahC'"
b'The Oil Fields discussed in my speech on Turkey/Kurds yesterday were held by ISIS until the United States took them\xe2\x80\xa6 t.co/9z1mVFMfZX'
"b'Thank you to House Republicans for being tough, smart, and understanding in detail the greatest Witch Hunt in Ameri\xe2\x80\xa6 t.co/VjjgJYnvGa'"
"b'The Federal Reserve is derelict in its duties if it doesn\xe2\x80\x99t lower the Rate and even, ideally, stimulate. Take a loo\xe2\x80\xa6 t.co/Yx0we2RvYr'"
b'Don\xe2\x80\x99t hurt them please! t.co/cKVa2HlJQb'
b'It is the only thing the Do Nothing Dems are doing! t.co/oqeetDNKzD'
b'Just a continuation of the Witch Hunt! t.co/TTCXcg0jdU'
"b'(Kiddingly) We\xe2\x80\x99re building a Wall in Colorado\xe2\x80\x9d(then stated, \xe2\x80\x9cwe\xe2\x80\x99re not building a Wall in Kansas but they get the b\xe2\x80\xa6 t.co/90eXJgZ6de'"
"b'PROMISES MADE, PROMISES KEPT! t.co/kCkw3K8k5o'"
"b'It was wonderful to be back in Pittsburgh, Pennsylvania with the incredible Patriots who fuel our factories, light\xe2\x80\xa6 t.co/04NVNGhF7d'"
"b'It would be really great if the people within the Trump Administration, all well-meaning and good (I hope!), could\xe2\x80\xa6 t.co/R0cbyiJHmb'"
"b'....Does anybody think this is fair? Even though there was no quid pro quo, I\xe2\x80\x99m sure they would like to try. Worse than the Dems!'"
"b'Never Trumper Republican John Bellinger, represents Never Trumper Diplomat Bill Taylor (who I don\xe2\x80\x99t know), in testi\xe2\x80\xa6 t.co/sWQXL60oqG'"
b'Only one knows who the \xe2\x80\x9cwhistleblower\xe2\x80\x9d is and who their sources are: RepAdamSchiff.Why?'
b'Members and the thousands of constituents they represent have a\xe2\x80\xa6'
"b'The Never Trumper Republicans, though on respirators with not many left, are in certain ways worse and more dangero\xe2\x80\xa6 t.co/xYkUiEWRuN'"
"b'\xe2\x80\xa2 Why is this so-called ""inquiry"" being ran secretly in the ba\xe2\x80\xa6'"
b'Thank you General Mazloum for your kind words and courage. Please extend my warmest regards to the Kurdish people.\xe2\x80\xa6 t.co/87Ai6xndRw'
b'1- I just spoke with President Trump and explained to him the Turkish violations of the truce that would not\xe2\x80\xa6'
b'2. We THANK President Trump for his tireless efforts that stopped the brutal Turkish attack and jihadist grou\xe2\x80\xa6'
b't.co/7Ud0WLyo4g'
b'Where\xe2\x80\x99s the Whistleblower?'
b'Big success on the Turkey/Syria Border. Safe Zone created! Ceasefire has held and combat missions have ended. Kurds\xe2\x80\xa6 t.co/GPmce2penO'
b'....feel EMPOWERED. There\xe2\x80\x99s a movement happening on these campuses like I\xe2\x80\x99ve never seen before. When you have 3000\xe2\x80\xa6 t.co/VK03WZAKr8'
b'....Order a couple of months ago saying that any school that does not uphold the First Amendment Rights of its stud\xe2\x80\xa6 t.co/4Eec07cqxN'
b'Young campus Conservatives are flocking to Turning Point USA andamp; other Conservative speaker events all over the Count\xe2\x80\xa6 t.co/Kcevkl2ayD'
b'Thank\xe2\x80\xa6'
b'Republicans are going to fight harder than ever to win back the House because of what the Do Nothing Democrats have done to our Country!'
b'Neither he (Taylor) or any other witness has provided testimony that the Ukrainians were aware that military aid wa\xe2\x80\xa6 t.co/hWjKgcVDz2'
b'Fact: Democrats introdu\xe2\x80\xa6'
b'Democrats and the media d\xe2\x80\xa6'
b' Tens of thousands came to Dallas to show\xe2\x80\xa6'
b'They are\xe2\x80\xa6'
b'It never ends. The Do Nothing Dems are terrible! t.co/l7Qk0WU8ML'
b'They will NEVER beat realDonaldTrump on policy or merit and they\xe2\x80\xa6'
b'New video from GOP captures just some of the excitement f\xe2\x80\xa6'
b'Thank you Steve! t.co/ROfsFdSGZO'
b'\xe2\x80\x9cThere is nothing from anything t\xe2\x80\xa6'
b'The Democrats Scam goes on and on! They Do Nothing! t.co/4ER1m6e39s'
b'The Witch Hunt continues! t.co/pBzhZfJEYb'
b'The Do Nothing Dems have nothing but time! t.co/g9wsBfk16W'
"b'Wrong, never even discussed this with Kellyanne Conway or Steve Mnuchin. Just more Fake News! t.co/bgR8TnytjJ'"
"b'Good news seems to be happening with respect to Turkey, Syria and the Middle East. Further reports to come later!'"
b'Great Job Tim! t.co/WhgO67CfKP'
b'\xe2\x80\x9cThe Democrats are trying to draw out this inquiry because they don\xe2\x80\x99t have the support. Donald Trump is guilty only\xe2\x80\xa6 t.co/ehoKmcYJlV'
"b'Can\xe2\x80\x99t believe that Nervous Nancy Pelosi isn\xe2\x80\x99t moving faster on USMCA. Her people want it, they don\xe2\x80\x99t know why she i\xe2\x80\xa6 t.co/RIjzWXlUGN'"
b'95% Approval Rating in the Republican Party. Thank you!'
b'Thank you Republicans. 185 out of 185 present voted for \xe2\x80\x9cUS\xe2\x80\x9d last night. Really good!'
"b'So some day, if a Democrat becomes President and the Republicans win the House, even by a tiny margin, they can imp\xe2\x80\xa6 t.co/Q4pOK3kZ4i'"
b'...kilmeade \xe2\x80\x9cI want to know about Hillary Clinton with the Dossier? I want to know if there was FISA abuse? We\xe2\x80\x99\xe2\x80\xa6 t.co/KO8XzDI81f'
b'...A majority do not want him Impeached and removed from office. 94% of the people in these battleground states who\xe2\x80\xa6 t.co/JHBVtBfAkr'
"b'\xe2\x80\x9cI thought a very revealing poll was done by The New York Times. By about a 10 point margin, those in battleground\xe2\x80\xa6 t.co/NMC18sMQ2d'"
"b'\xe2\x80\x9cThe Ambassador to the European Union has already testified, he said there was no quid pro quo. He said the Preside\xe2\x80\xa6 t.co/zpqcJgc4Xh'"
b'Congratulations to JustinTrudeau on a wonderful and hard fought victory. Canada is well served. I look forward to\xe2\x80\xa6 t.co/H3e0DSQgAP'
"b'Of course, Democrats\xe2\x80\xa6'"
"b""Here's the reality:- All done in secret- Led by proven-l\xe2\x80\xa6"""
b'I guess Democrats are okay with Adam Schiff:\xe2\x96\xaa\xef\xb8\x8f Spreading\xe2\x80\xa6'
b'Thank you Liz. Shows great Republican support! t.co/WsuTmv6Tfh'
b'Tonight Republicans will move to censure andamp; condemn him for deliberate\xe2\x80\xa6'
b'Thank you Dan and Kevin. Great Vote! t.co/MMJ5SanakG'
b'Will be interviewed by seanhannity tonight at 9:00 P.M. on FoxNews. Enjoy!'
"b'Doral in Miami would have been the best place to hold the G-7, and free, but too much heat from the Do Nothing Radi\xe2\x80\xa6 t.co/THW5r9YzOG'"
"b'Censure (at least) Corrupt Adam Schiff! After what he got caught doing, any pol who does not so vote cannot be hone\xe2\x80\xa6 t.co/9e3aXSBYYC'"
"b'Great new book by wonderful and very street smart author Dan Bongino, EXONERATED, THE FAILED TAKEDOWN OF PRESIDENT\xe2\x80\xa6 t.co/YcSTyDGgjQ'"
b't.co/R3Chppjx6S'
b't.co/6sKKniiOfE'
b'A Great Democrat Scam! t.co/LbkVT7UvXX'
b'Adam Schiff is a Corrupt Politician! t.co/16aSrqjwu2'
b'This is the most crucial statistic of the 2020 election: Average American middle class household income:\xe2\x80\xa6'
b'Congratulations Barbara! t.co/0cYrjL1YOj'
"b'\xe2\x80\x9cTo the Democrats, Impeachment is partisan politics dressed up as principle.\xe2\x80\x9d SteveHiltonx FoxNews'"
"b'So interesting that, when I announced Trump National Doral in Miami would be used for the hosting of the G-7, and t\xe2\x80\xa6 t.co/tDDMw6CPOd'"
"b'....fiction to Congress and the American People? I demand his deposition. He is a fraud, just like the Russia Hoax\xe2\x80\xa6 t.co/Hum7mHfNiV'"
b'....because their so-called story didn\xe2\x80\x99t come even close to matching up with the exact transcript of the phone call\xe2\x80\xa6 t.co/SUGMgGZeJ3'
"b'This Scam going on right now by the Democrats against the Republican Party, and me, was all about a perfect phone c\xe2\x80\xa6 t.co/nXPfrl25ag'"
"b'Pelosi is now leading a delegation of 9, including Corrupt Adam Schiff, to Jordan to check out Syria. She should fi\xe2\x80\xa6 t.co/FBznZni7FF'"
b't.co/dNfXkc8uUG'
b't.co/kNVQf6JdIL'
b'\xe2\x80\x9cThe ceasefire is holding up very nicely. There are some minor skirmishes that have ended quickly. New areas being\xe2\x80\xa6 t.co/TzJkyag5JH'
b'The WALL is making a very big difference. Even Dems in area are happy! t.co/NDzq2oIsHV'
b' t.co/oHRgIpFGV1'
b't.co/kNVQf6JdIL'
"b'So now Crooked Hillary is at it again! She is calling Congresswoman Tulsi Gabbard \xe2\x80\x9ca Russian favorite,\xe2\x80\x9d and Jill St\xe2\x80\xa6 t.co/qBeaGRueWS'"
b'Never give up. We are doing GREAT! We are WINNING! t.co/MKDn5WStFU'
"b'....Therefore, based on both Media andamp; Democrat Crazed and Irrational Hostility, we will no longer consider Trump Nat\xe2\x80\xa6 t.co/qJPYSwIfGP'"
b't.co/dNfXkc8uUG'
b'.....its own 50 to 70 unit building. Would set up better than other alternatives. I announced that I would be willi\xe2\x80\xa6 t.co/F3PB9Xzseu'
"b'I thought I was doing something very good for our Country by using Trump National Doral, in Miami, for hosting the\xe2\x80\xa6 t.co/lfJvhCW1v0'"
b'\xe2\x80\x9cThe President never told me to withhold any money until the Ukrainians did anything related to the server. The onl\xe2\x80\xa6 t.co/1Zivgzpe69'
b'See you there! t.co/msBoZ1TbNX'
b't.co/yvsGhK5N9X'
"b'Crooked Hillary Clinton just called the respected environmentalist and Green Party candidate, Jill Stein, a \xe2\x80\x9cRussia\xe2\x80\xa6 t.co/X4THYpEAJw'"
b'It is ONLY about this! t.co/ZB5xPDKs4b'
"b'Just another FAKE SUPPRESSION POLL, this time from FoxNews, of course! t.co/x8lYVE7QCo'"
b'RepMcClintock Thank you Tom. Great interview on TeamCavuto! FoxNews'
b'A Great Book by Kimberley Strassel! t.co/TOQcUDmnAR'
b'It\xe2\x80\x99s time for Pelosi to put the '
b't.co/rj15fMyHyF'
b' We won\xe2\x80\x99t let that happen! t\xe2\x80\xa6'
b' Must-watch breakdown of the me\xe2\x80\xa6'
b'\xc2\xa1Latinos alrededor de los Estados Unidos est\xc3\xa1n motivados\xe2\x80\xa6'
b'\xe2\x80\x9cI don\xe2\x80\x99t see anything that constitutes an Impeachable offense - Nothing here rises to the level of Impeachment. The\xe2\x80\xa6 t.co/9WDifJx3yZ'
b'Where were the MSM attacks th\xe2\x80\xa6'
b'\xe2\x80\x94Let Syria cross his \xe2\x80\x9cred line\xe2\x80\x9d\xe2\x80\x94Hillary\xe2\x80\x99s Failed Russian Reset\xe2\x80\x94$150 Billion in cash to our en\xe2\x80\xa6'
b' We\xe2\x80\x99ll see about that . . . t.co/oD\xe2\x80\xa6'
b'Thank you very much. Working hard! t.co/z8dgzQxkVC'
b'I agree! t.co/mxKKg98NvO'
b'Texas is great! t.co/aJSyPSHJfw'
b'There has never been a greater fraud on Congress. Shifty Schiff is Corrupt. Go Andy! t.co/yw57NhKpG2'
"b'Such a disgrace that the Do Nothing Democrats are doing just as their name suggests, Doing Nothing! USMCA anyone?'"
"b'While some may be trying to sabotage our efforts, we will not be deterred. We wil\xe2\x80\xa6'"
"b'Susan Rice, who was a disaster to President Obama as National Security Advisor, is now telling us her opinion on wh\xe2\x80\xa6 t.co/1IrtH5McCg'"
"b'Pelosi and Impeachment - There have already been 3 Votes, and they\xe2\x80\x99ve all failed miserably. Here\xe2\x80\x99s why there may no\xe2\x80\xa6 t.co/Phv5Jtemmt'"
"b'Congressman Michael McCaul, \xe2\x80\x9cSchiff\xe2\x80\x99s inquiry defies Democracy.\xe2\x80\x9d FoxNews seanhannity'"
"b'\xe2\x80\x9cBecause the House has already voted against the Impeachment Proceeding, the current inquiry is totally invalid. Th\xe2\x80\xa6 t.co/PZIzcO2WiE'"
b'Corrupt Congressman Adam Schiff is angry that Ambassadors that he thought would be good for his fraudulent Witch Hu\xe2\x80\xa6 t.co/8a8f8mqZb6'
b't.co/Q2ar4LZGM4'
"b'Think of how many lives we saved in Syria and Turkey by getting a ceasefire yesterday. Thousands and thousands, and maybe many more!'"
b't.co/p5imhMJqS1'
"b'....He is also my friend! At the same time, I am pleased to nominate Deputy Secretary Dan Brouillette to be the new\xe2\x80\xa6 t.co/Pcc3G5sxtR'"
b'I want to thank Secretary of Energy Rick Perry for the outstanding job he has done. He will be leaving at the end o\xe2\x80\xa6 t.co/t1P7C4XOq1'
"b'Can you believe I am doing this important work for our Country, and have to deal with Corrupt Adam Schiff and the D\xe2\x80\xa6 t.co/a9HvmsXW6O'"
b'DEFEAT TERRORISM! t.co/8WbnLPgWIK'
"b'....I have just been notified that some European Nations are now willing, for the first time, to take the ISIS Figh\xe2\x80\xa6 t.co/2x0Hbvck3H'"
"b'.....this thinking years ago. Instead, it was always held together with very weak bandaids, andamp; in an artificial mann\xe2\x80\xa6 t.co/xfVVvkP3Jt'"
b'Just spoke to President '
b'The USA! t.co/Zdj3Lyo76H'
"b'Democrats are now the party of high taxes, high crime, open borders, late-term abortion, socialism, and blatant cor\xe2\x80\xa6 t.co/tSNbCqhzVE'"
"b'Tonight, we forcefully condemn the blatant corruption of the Democrat Party, the Fake News Media, and the rogue bur\xe2\x80\xa6 t.co/LnlkBTfhUx'"
"b'The radical left tolerates no dissent, it permits no opposition, it accepts no compromise, and it has absolutely no\xe2\x80\xa6 t.co/J5ruRNe7G1'"
"b'Thank you Dallas, Texas - I love you! t.co/meWpesDYeM'"
"b'Just arrived at the American Airlines Center in Dallas, Texas. Will be out shortly as we wait for more of you to ge\xe2\x80\xa6 t.co/ef6YyOIG3p'"
"b'See you soon Dallas, Texas! t.co/Sg6xtp1vqQ'"
"b'This is a great day for civilization. I am proud of the United States for sticking by me in following a necessary,\xe2\x80\xa6 t.co/4dKcAXxcHj'"
b'This deal could NEVER have been made 3 days ago. There needed to be some \xe2\x80\x9ctough\xe2\x80\x9d love in order to get it done. Grea\xe2\x80\xa6 t.co/nkpY0r5ti2'
b'Great news out of Turkey. News Conference shortly with VP and SecPompeo. Thank you to '
"b'This number, based on the Economy andamp; how well our Country is doing, would potentially be 75% if not for the Fake New\xe2\x80\xa6 t.co/wREm2kFsaC'"
"b'So true, SteveScalis\xe2\x80\xa6'"
b'As the Witch Hunt continues! t.co/klvvwSXq7M'
b'The Greatest Witch Hunt in American History! t.co/sPnloffJMT'
b'My warmest condolences to the family and many friends of Congressman Elijah Cummings. I got to see first hand the s\xe2\x80\xa6 t.co/IVXZYgOkyg'
b'This is the real story. Thank you Jim! t.co/VqJrsUJdiX'
b'I am the only person who can fight for the safety of our troops andamp; bring them home from the ridiculous andamp; costly Endl\xe2\x80\xa6 t.co/Myfg3mkPGS'
"b'\xe2\x80\x9cAbout 500,000 human beings were killed in Syria while Barack Obama was president andamp; leading for a \xe2\x80\x9cpolitical settle\xe2\x80\xa6 t.co/77ONloetaY'"
b'Pelosi and Schiff are trying to impeach realDonaldTrump behind closed\xe2\x80\xa6'
b't.co/ZtCSrCqJcN'
"b'Hope all House Republicans, and honest House Democrats, will vote to CENSURE Rep. Adam Schiff tomorrow for his braz\xe2\x80\xa6 t.co/UTBkc10nhf'"
"b'\xe2\x80\x9cWhat has happened here with the Anthony Wiener laptop, the Server, all of the Emails between Huma Abedin and Hilla\xe2\x80\xa6 t.co/ELyAWDQbdb'"
"b'THANK YOU you Dallas, Texas. See you tomorrow night at the American Airlines Center! t.co/fbtzlbroQi'"
b'\xe2\x80\x9cThis President is the most patriotic President I\xe2\x80\x99ve seen in many years. He is going to do what is good for America\xe2\x80\xa6 t.co/2JbKc2WqXK'
"b'Nancy Pelosi needs help fast! There is either something wrong with her \xe2\x80\x9cupstairs,\xe2\x80\x9d or she just plain doesn\xe2\x80\x99t like o\xe2\x80\xa6 t.co/X481eoECXa'"
"b'The Do Nothing Democrats, Pelosi and Schumer stormed out of the Cabinet Room! t.co/hmP4FNhemv'"
"b""Nervous Nancy's unhinged meltdown! t.co/RDeUI7sfe7"""
b'Do you think they like me? t.co/TDmUnJ8HtF'
"b'I\xe2\x80\x99m fighting for the American people, but the Democrats\xe2\x80\x99 sole focus is fighting against ME with their fraudulent Wi\xe2\x80\xa6 t.co/8P09w45uGC'"
"b'THANK YOU, WORKING HARD! t.co/sNUppjB4Xm'"
"b'Guatemala, Honduras andamp; El Salvador have all signed historic Asylum Cooperation Agreements and are working to end the\xe2\x80\xa6 t.co/yD17W9yoC2'"
"b'Senator Rand Paul just wrote a great book, \xe2\x80\x9cThe Case Against Socialism\xe2\x80\x9d which is now out. Highly recommended \xe2\x80\x93 as A\xe2\x80\xa6 t.co/GblFOclQdM'"
"b'Republicans are totally deprived of their rights in this Impeachment Witch Hunt. No lawyers, no questions, no trans\xe2\x80\xa6 t.co/Qd968Gn6bI'"
"b'Our record Economy would CRASH, just like in 1929, if any of those clowns became President!'"
"b'95% Approval Rating in the Republican Party. Thank you! Just won two Congressional Seats in North Carolina, andamp; a Go\xe2\x80\xa6 t.co/XOLNddjsgk'"
