"b'95% Approval Rate in the Republican Party, a record! Thank you!'"
b'Thank you Kevin for the nice words! t.co/DfY1V38EhD'
b'....Sondland said Trump told him. None of this will move the needle for anyone. And now Dems in Swing Districts hea\xe2\x80\xa6 t.co/h5ysRHtCVn'
b'....ANY DIRECT EVIDENCE THAT PRESIDENT TRUMP DID ANYTHING IMPEACHABLE. No one heard him order a quid pro quo. No on\xe2\x80\xa6 t.co/05oujkZc08'
b'NEW YORK POST EDITORIAL. \xe2\x80\x9cWorse Than Pointless. All those hours of televised testimony plainly failed on their anno\xe2\x80\xa6 t.co/1XAuOFHyVk'
"b'Daniel Cameron, who just won the A.G. race in the Great Commonwealth of Kentucky, is a young and very talented poli\xe2\x80\xa6 t.co/l6Nw61LPHy'"
"b'.....Brennan, too. And the Whistleblower also worked for Susan Rice. It\xe2\x80\x99s an understatement to say that this is a W\xe2\x80\xa6 t.co/Kc4WtfYQbo'"
"b'\xe2\x80\x9cThe Democrats dirty tricks have started this whole thing. The Whistleblower, the guy who took his case to Schiff\xe2\x80\x99s\xe2\x80\xa6 t.co/ufbUmLQFvs'"
"b'Joe Concha, The Hill: \xe2\x80\x9cIn Emerson College Poll, Impeachment among independents, 49% Oppose, 34% Support. You see wh\xe2\x80\xa6 t.co/bocPR9Om0g'"
"b'Adam Schiff will be compelled to testify should the Democrats decide, despite the fact that my presidential convers\xe2\x80\xa6 t.co/bD2rqpRbSx'"
b'\xe2\x80\x9cThe support for Impeachment is not there. I think the Democrats will have to come up with a new game plan.\xe2\x80\x9d jasoninthehouse FoxNews'
b'\xe2\x80\x9cHorowitz reportedly finds evidence FBI lawyer falsified FISA doc\xe2\x80\x9dt.co/RzSF3\xe2\x80\xa6'
b'BretBaier t.co/gBPNYvYPjW'
b'The American people see through thi\xe2\x80\xa6'
b't.co/Mn4EJ7Jbh8'
b'...House Republicans are showing real LEADERSHIP and prepared to enact bipartisan solutions for drug prices. Do Not\xe2\x80\xa6 t.co/YkzY7kPOKw'
b'...Pelosi and her Do Nothing Democrats drug pricing bill doesn\xe2\x80\x99t do the trick. FEWER cures! FEWER treatments! Time\xe2\x80\xa6 t.co/DPhFX0VKoO'
"b'...While we had the first prescription drug price decrease in 50 years, Americans still pay far too much for drugs\xe2\x80\xa6 t.co/1qy4kNPIg1'"
b'SecAzar and I will soon release a plan to let Florida and other States import prescription drugs that are MUCH CH\xe2\x80\xa6 t.co/KUCvUfA3JU'
b'Thank you to senatemajldr Mitch McConnell and GOPLeader Kevin McCarthy for their Great Leadership! There has neve\xe2\x80\xa6 t.co/4armKSJjEo'
"b'I will be interviewed on foxandfriends this morning at 8:00 A.M. I know that there\xe2\x80\x99s not much to talk about, but w\xe2\x80\xa6 t.co/m84uCLYbSw'"
"b'\xe2\x80\x9cFormer FBI Employee Accused of Altering FISA Documents.\xe2\x80\x9d Hello, here we go! foxandfriends'"
b'No evidence of im\xe2\x80\xa6'
"b'In 2014, Ukraine\xe2\x80\x99s president went before Congr\xe2\x80\xa6'"
b'realDonaldTrump\xe2\x80\x99s approval is the highest it\xe2\x80\x99s been since\xe2\x80\xa6'
b'BULL-SCHIFF!Get your 100% cotton\xe2\x80\xa6'
"b'In 2020, it is now \xe2\x80\x9cimagine all th\xe2\x80\xa6'"
b' We won\xe2\x80\x99t let them take awa\xe2\x80\xa6'
b'Arizona is ready to stay red in 20\xe2\x80\xa6'
b't.co/h92LyjD0Eh'
b't.co/HvYx12NUkS'
"b'Thankfully, this ci\xe2\x80\xa6'"
b'But he didn\xe2\x80\x99t remember Mr. Holmes briefing him about a call that was \xe2\x80\x9c\xe2\x80\xa6'
b'Holmes could hear the Ukraine portion of the call btw Tr\xe2\x80\xa6'
b'THIS is the Democrats\xe2\x80\x99 la\xe2\x80\xa6'
"b'....They want ZERO transparency, thinking the world will not find out the death and tragedy that the Iranian Regime is causing!'"
b'Iran has become so unstable that the regime has shut down their entire Internet System so that the Great Iranian pe\xe2\x80\xa6 t.co/I4vU4GBbP3'
b'.....President Trump said the Ukraine President should just do the right thing (No Quid Pro Quo). You shouldn\xe2\x80\x99t cha\xe2\x80\xa6 t.co/KYCFRafcXe'
"b'Ken Starr, Former Independent Counsel: \xe2\x80\x9cDoes this reach the level of treason, bribery or other high crimes and misd\xe2\x80\xa6 t.co/q8Eq3y6IDs'"
"b'I have been watching people making phone calls my entire life. My hearing is, and has been, great. Never have I bee\xe2\x80\xa6 t.co/VR26t3fTci'"
b'Read the two Transcripts of Ukrainian calls!'
b'The Navy will NOT be taking away Warfighter and Navy Seal Eddie Gallagher\xe2\x80\x99s Trident Pin. This case was handled very\xe2\x80\xa6 t.co/bnsXBbbApf'
b'....\xe2\x80\x9dNothing gives Schiff jurisdiction over Impeachment.\xe2\x80\x9d'
b'\xe2\x80\x9cThe new House Resolution gives Adam Schiff (the most dishonest man in politics) the power unilaterally to release\xe2\x80\xa6 t.co/ecrEKSidQl'
"b'.....But we are winning big, and they will soon be on our turf.'"
"b'Corrupt politician Adam Schiff\xe2\x80\x99s lies are growing by the day. Keep fighting tough, Republicans, you are dealing wit\xe2\x80\xa6 t.co/pApmJBCJtk'"
"b'I never in my wildest dreams thought my name would in any way be associated with the ugly word, Impeachment! The ca\xe2\x80\xa6 t.co/dmAnTrffL1'"
b'\xe2\x80\x9cFreed Taliban hostages arrive in Germany.\xe2\x80\x9d foxandfriends FoxNews OANN We got them back!'
"b'.....President before. What they are doing is not legal. But I\xe2\x80\x99m clean, and when I release my financial statement (\xe2\x80\xa6 t.co/cF6G4yPpoe'"
"b'Bob Mueller, after spending two years and 45 million dollars, went over all of my financials, andamp; my taxes, and found\xe2\x80\xa6 t.co/o4PI9n5QCM'"
"b'The Republican Party, and me, had a GREAT day yesterday with respect to the phony Impeachment Hoax, andamp; yet, when I g\xe2\x80\xa6 t.co/gQBg3cjfLJ'"
"b'During my visit yesterday to Austin, Texas, for the startup of the new Mac Pro, andamp; the discussion of a new one $bill\xe2\x80\xa6 t.co/YB27KtIrRL'"
"b'Why do ShannonBream andamp; FoxNews waste airtime on Democrat Rep. Eric Swalwell, who recently left the Presidential Pr\xe2\x80\xa6 t.co/plriOIZ2lE'"
b't.co/osezECwPO1'
b'Poll: Trump leads top 2020 Democrats in Wisconsin t.co/P7z7Si8I0h.'
"b'\xe2\x80\x9cAll four of Gordon Sondland\xe2\x80\x99s lawyers are Democrat Donors.\xe2\x80\x9d TuckerCarlson Despite this, big win today for Republicans!'"
"b'Watch TuckerCarlson, seanhannity, IngrahamAngle. Big News! FoxNews'"
b't.co/ytr7dRvbUc t.co/G6lGfyxSUs'
"b'If this were a prizefight, they\xe2\x80\x99d stop it!'"
b'Today I opened a major Apple Manufacturing plant in Texas that will bring high paying jobs back to America. Today N\xe2\x80\xa6 t.co/IMdAKp9o8e'
"b'Q: ""You testified, \'Preside\xe2\x80\xa6'"
"b'RepMikeTurner: ""Mr. Sondland, let\'s be clear: no one on this planet\xe2\x80\x94not Donald Trump, Rudy Guiliani, Mick Mulvan\xe2\x80\xa6'"
b'The Ukrainians got a call from the President.The Ukrainians got a meeting with the Presi\xe2\x80\xa6'
b'Courtesy of RepMikeTurner \xe2\x9e\xa1\xef\xb8\x8fQ: No one else on this planet told you that Donal\xe2\x80\xa6'
b'I WANT NOTHING! t.co/KKUfwSIRAi'
"b'....\xe2\x80\x9dI WANT NOTHING! I WANT NOTHING! I WANT NO QUID PRO QUO! TELL PRESIDENT ZELENSKY TO DO THE RIGHT THING!\xe2\x80\x9d Later,\xe2\x80\xa6 t.co/ILD8Ns1XGm'"
b'Impeachment Witch Hunt is now OVER! Ambassador Sondland asks U.S. President (me): \xe2\x80\x9cWhat do you want from Ukraine? I\xe2\x80\xa6 t.co/m2H5hHC4ok'
b'We join families of Kevin King andamp; Tim Weeks in celebrating their release from Taliban captivity. Thanks to President\xe2\x80\xa6 t.co/suyld231na'
b't.co/HbgEgZsPZ9'
b't.co/LUTtELrmZX t.co/6ebGGBb\xe2\x80\xa6'
"b'Trump reportedly responded: ""I want nothing,\xe2\x80\xa6'"
b'- Another witness who never heard anything from the President- Reach\xe2\x80\xa6'
b'Sondland: No.Q: Any pre-condit\xe2\x80\xa6'
b'Nancy Pelosi will go down as the least productive Speaker of the House in history. She is dominated by AOC Plus 3 a\xe2\x80\xa6 t.co/SXyUXqY4Qx'
b'\xe2\x80\x9cWhite House Confidence Grows As Hearings Wear On.\xe2\x80\x9d WashTimes This is just an attempted takedown of the Republica\xe2\x80\xa6 t.co/QEPCCoVifo'
b'The three year Hoax continues! t.co/Yht2KQb5aW'
b'True. Great job RepMikeTurner! t.co/T0AdyNLuVb'
b'Read the transcripts! t.co/gQxYzjWehV'
"b'Morrison: ""Correct."" ""No Bribery?""""Correct.""""No Extortion?""""Correct.""Ste\xe2\x80\xa6'"
b'Thank you Tennessee! t.co/MYP1FaJhUx'
"b'Congressman Van Drew (D-NJ): We\xe2\x80\x99ve spent millions of Dollars, in my opinion, tons of money, tons of time, tons of h\xe2\x80\xa6 t.co/cFwanfkSK2'"
b'- no violation of law or executive order- no ment\xe2\x80\xa6'
b'A\xe2\x80\xa6'
b'RepMikeTurner: Did he ever say to you that he was not going\xe2\x80\xa6'
b'\xe2\x9d\x8cNO QUID PRO QUO\xe2\x9d\x8cNO BRIBERY\xe2\x9d\x8cNO EXTOIn shor\xe2\x80\xa6'
"b'A great day for Republicans, a great day for our Country!'"
"b'I agree, but in the end we will win and save our Country from certain destruction! t.co/CPjdxq5hXT'"
b'Both conti\xe2\x80\xa6'
b'3 wit\xe2\x80\xa6'
b'Another witness just told\xe2\x80\xa6'
b'More witnesses confirmed today that they were never asked to br\xe2\x80\xa6'
b't.co/z0I7wBsgTP'
b'Nothing has changed. Not\xe2\x80\xa6'
b'While SpeakerPelo\xe2\x80\xa6'
"b'Democrats poll-tested, and they found that the crime of \xe2\x80\x9cbribery\xe2\x80\x9d alarms voters the most. The on\xe2\x80\xa6'"
b'\xe2\x80\xa2 Republicans are on \xf0\x9f\x94\xa5\xe2\x80\xa2 Democrats can\xe2\x80\x99t hide the facts in their secret bunker anymore. \xe2\x80\xa2 The Presid\xe2\x80\xa6'
"b'- President Trump made no ""demand"" of President Zelensky. - President Zel\xe2\x80\xa6'"
b'RepAdamSchiff claims he doesn\xe2\x80\x99t know the \xe2\x80\x9cWhistlebl\xe2\x80\xa6'
b'The problem with that focus-group-tested narrative? No witness h\xe2\x80\xa6'
"b'Consistent with the statements from Ukrainian leaders, Vindman testifies that he did not hea\xe2\x80\xa6'"
b'\xe2\x9d\x8c The President doesn\xe2\x80\x99t get to request witnesses.\xe2\x9d\x8c The Presiden\xe2\x80\xa6'
"b'""What is the full extent of the Democrats\xe2\x80\x99 prior coordination with the Wh\xe2\x80\xa6'"
b't.co/HvYx12NUkS'
b'NASDAQ UP 27% THIS YEAR ALONE!'
"b'Nancy Pelosi just stated that \xe2\x80\x9cit is dangerous to let the voters decide Trump\xe2\x80\x99s fate.\xe2\x80\x9d FoxNews In other words, sh\xe2\x80\xa6 t.co/VCbR81xgCh'"
b'The Do Nothing Democrats have disgraced our great Country! t.co/lcSs55Wo18'
"b'At my meeting with Jay Powell this morning, I protested fact that our Fed Rate is set too high relative to the inte\xe2\x80\xa6 t.co/Rot4eN2onP'"
b'Mark Levin speaking one week after I took office. This was always a planned COUP and the Radical Left Democrats wil\xe2\x80\xa6 t.co/LYcERRm8yS'
b'GREAT NEWS! t.co/GXDE2IlGGu'
b'THANK YOU! t.co/igO1r1cTHS'
b't.co/BKo27n6tmz'
b'\xe2\x80\x9cCongressman Van Drew (D-NJ) SLAMS Democrats for \xe2\x80\x98fracturing the Nation\xe2\x80\x99 with Impeachment probe. \xe2\x80\x98We already know h\xe2\x80\xa6 t.co/O8HA366ITq'
b'Just finished a very good andamp; cordial meeting at the White House with Jay Powell of the Federal Reserve. Everything w\xe2\x80\xa6 t.co/tHedonx5Lt'
b'....that I testify about the phony Impeachment Witch Hunt. She also said I could do it in writing. Even though I di\xe2\x80\xa6 t.co/ImLbzO2sz1'
"b'Our Crazy, Do Nothing (where\xe2\x80\x99s USMCA, infrastructure, lower drug pricing andamp; much more?) Speaker of the House, Nervou\xe2\x80\xa6 t.co/WFQVQ4Frk9'"
b'Never has the Republican Party been so united as it is now. 95% A.R. This is a great fraud being played out against\xe2\x80\xa6 t.co/KMD9WrN098'
b'Schiff controls how Republicans use our question time.Schiff controls what gets release\xe2\x80\xa6'
b't.co/Mqj5tXaDAz'
b'\xe2\x80\x9cAll they do is bring up witnesses who didn\xe2\x80\x99t witness anything.\xe2\x80\x9d KatrinaPierson SteveHiltonx Nothing matters exc\xe2\x80\xa6 t.co/mOVG17IFDL'
b'\xe2\x80\x9cThe Impeachment started before he even became President.\xe2\x80\x9d greggutfeld FoxNews'
b't.co/1Rg66Tn4uP'
b't.co/D66PEkuX6d'
b'Where is the Fake Whistleblower?'
b't.co/ru2n7i2gzu'
"b'Republicans andamp; others must remember, the Ukrainian President and Foreign Minister both said that there was no pressu\xe2\x80\xa6 t.co/mFL4wwDR8b'"
"b'The Crazed, Do Nothing Democrats are turning Impeachment into a routine partisan weapon. That is very bad for our C\xe2\x80\xa6 t.co/8imWgyrBin'"
"b'Tell Jennifer Williams, whoever that is, to read BOTH transcripts of the presidential calls, andamp; see the just release\xe2\x80\xa6 t.co/z5Iwr6LSOp'"
b't.co/I3lO117SVh'
b'Paul Krugman of nytimes has been wrong about me from the very beginning. Anyone who has followed his \xe2\x80\x9cwords of wis\xe2\x80\xa6 t.co/vLB1qdYWz6'
b'Schiff is a Corrupt Politician! t.co/DDBqlfIFLV'
"b'SteveScalise blew the nasty andamp; obnoxious Chris Wallace (will never be his father, Mike!) away on Chris\xe2\x80\x99s lowest ra\xe2\x80\xa6 t.co/kIXKIiCBQd'"
b'Thanks Eric! t.co/6Ai7bqto3P'
b't.co/nJBvFD1fGD'
b't.co/N6jsblFuMc'
b't.co/8bPq1Oy71z'
b'Paul Krugman has called me wrong from day one. People at the Failing New York Times are very angry at him for havin\xe2\x80\xa6 t.co/qmCAmTpOko'
b't.co/Ypzhrlpgkz'
b'\xe2\x9c\x94\xef\xb8\x8f Spread false allegations about collusion\xe2\x9c\x94\xef\xb8\x8f Fabricated a call transcript during a congressiona\xe2\x80\xa6'
b't.co/Ks1BN41CGf'
b' Hours of hearsay from handpicke\xe2\x80\xa6'
b't.co/YvlBpfsiTa'
b't.co/z0I7wBsgTP'
b'A new with RepGregWalden debunking Pelosi\xe2\x80\x99s drug pricing scheme. t.co/u9a8YBmb6o'
"b'I agree Katrina, Pam Bondi is a great woman! t.co/NllcAz0bWB'"
b'This circ\xe2\x80\xa6'
b'The Do Nothing Dems are now doing even less - and soooo much work to be done!'
"b'Joe Ricketts, one of our Country\xe2\x80\x99s most successful businessmen, including being the owner of the Chicago Cubs, has\xe2\x80\xa6 t.co/AZU3tnBHvm'"
b'A BIG difference! t.co/DFjge9s7fO'
"b'Our great Farmers will recieve another major round of \xe2\x80\x9ccash,\xe2\x80\x9d compliments of China Tariffs, prior to Thanksgiving.\xe2\x80\xa6 t.co/whkNS2TsLY'"
"b'MariaBartiromo has a GREAT show going on right now, 10:00 A.M. Fantastic guests talk about the Fake Impeachment! FoxNews'"
"b'Mr. Chairman, Joe Biden may be Sleepy and Very Slow, but he is not a \xe2\x80\x9crabid dog.\xe2\x80\x9d He is actually somewhat better th\xe2\x80\xa6 t.co/0nVPyEFfgf'"
"b'Dowd never understood the pulse of the Republican Party, present or past. He\xe2\x80\x99s just a 3rd rate hit job for Fake New\xe2\x80\xa6 t.co/OemGtFOWid'"
b'A new Republican Star is born. Great going EliseStefanik! t.co/9QH4oUa2eg'
"b'Yovanovich: ""No.""""Do you have any info regarding any cr\xe2\x80\xa6'"
b'RepAdamSchiff can do nothing but watch his sham crumble. t.co/SeOfq3dB5c'
b'Thank you Pete. Our great warfighters must be allowed to fight. I would not have done this for Sgt. Bergdahl or Che\xe2\x80\xa6 t.co/bfn9C8I7WH'
b'Visited a great family of a young man under major surgery at the amazing Walter Reed Medical Center. Those are trul\xe2\x80\xa6 t.co/LBL2DrBpCg'
b't.co/5Tbgwkpv4p'
b't.co/65ERQ7YfUS'
b't.co/YqJrGDPAOj'
b'True! t.co/ySWZMUnQfd'
b'Congratulations Kimberley. Great book! t.co/IFlMf1qIrb'
"b'\xe2\x80\x9cI mean, come on. The Democrats are doing focus groups to try and figure out what words to use to move the needle.\xe2\x80\xa6 t.co/TiN02s4ykR'"
"b'\xe2\x80\x9cTriggered,\xe2\x80\x9d a great book by my son, Don. Now number one on NYTIMES LIST. Keep it there for a while!'"
"b'....and Taylor, dismissing everybody involved from the Obama holdover days trying to undermine Trump, getting rid o\xe2\x80\xa6 t.co/OI3LdIebvr'"
"b'\xe2\x80\x9cMy support for Donald Trump has never been greater than it is right now. It is paramountly obvious watching this,\xe2\x80\xa6 t.co/ds5t4N9fwp'"
"b'Dow hits 28,000 - FIRST TIME EVER, HIGHEST EVER! Gee, Pelosi andamp; Schitt have a good idea, \xe2\x80\x9clets Impeach the President\xe2\x80\xa6 t.co/x8fuxDPsDd'"
"b'LOUISIANA, VOTE EddieRispone TODAY! He will be a great governor!'"
b'Good morning Louisiana! Polls are open at 7AM. Get out and VOTE for EddieRispone to be your next Gov! He will get\xe2\x80\xa6 t.co/MVmnupg5CY'
b't.co/YvlBpfsiTa'
b'THANK YOU! t.co/Pcq7IbehVp'
b't.co/8h6ZmdGlPf t.co/shaijXMXli'
"b'Q: ""Do you have any information regarding POTUS a\xe2\x80\xa6'"
b' h\xe2\x80\xa6'
b'Why doesn\xe2\x80\x99t he want Republican members to ask questions?Why is he conductin\xe2\x80\xa6'
"b'Notice how, so far, the Democrats have been peppering the witness with questions asking her to spec\xe2\x80\xa6'"
b'....A double standard like never seen before in the history of our Country?'
"b'So they now convict Roger Stone of lying and want to jail him for many years to come. Well, what about Crooked Hill\xe2\x80\xa6 t.co/JAMq1fjRVz'"
"b'Stock Market up big. New and Historic Record. Job, jobs, jobs!'"
b'We have vacancies in various departments because we do not want or need as many people as past administrations (and\xe2\x80\xa6 t.co/GsZxGrOGUP'
b't.co/qz1OfL56rg'
b't.co/86HWwzDlEo'
b't.co/ObHvebm4ry'
"b'Another Record Stock Market, 21 times this year, despite an ongoing, andamp; totally unfounded, Witch Hunt, andamp; a Democrat\xe2\x80\xa6 t.co/gRAV8W5o7k'"
b'....They call it \xe2\x80\x9cserving at the pleasure of the President.\xe2\x80\x9d The U.S. now has a very strong and powerful foreign po\xe2\x80\xa6 t.co/D0ywsWUjAw'
"b'Everywhere Marie Yovanovitch went turned bad. She started off in Somalia, how did that go? Then fast forward to Ukr\xe2\x80\xa6 t.co/N6KQO9jBWS'"
"b'......filth pouring into the Pacific Ocean is rapidly becoming an environmental hazard, is getting NOTHING DONE. Sh\xe2\x80\xa6 t.co/ZMRViDxg4B'"
b'The Impeachment Witch Hunt should be over with the statement made last night by the President and Foreign Minister\xe2\x80\xa6 t.co/sbNUyq1ghc'
"b'....Ambassador Sondland did not tell us, and certainly did not tell me, about a connection between the assistance a\xe2\x80\xa6 t.co/y4aLvLfaXN'"
b'Democrats must apologize to USA: Ukrainian Foreign Minister Vadym Prystaiko said that \xe2\x80\x9cUnited States Ambassador Gor\xe2\x80\xa6 t.co/Y7eTx5RCfK'
"b'This Saturday, the eyes of history are looking at the people of Louisiana. If you want to defend your values, your\xe2\x80\xa6 t.co/iArddZXufJ'"
b'\xe2\x80\x9cI have never seen a direct relation\xe2\x80\xa6'
b'7/25\xe2\x80\x94Call between POTUS and Zelensky7/26\xe2\x80\x94Volker andamp; Taylor meet Zelensky8/27\xe2\x80\x94John Bolton meets Zelensky\xe2\x80\xa6'
b'Getting ready to land in Louisiana to do Rally with Great Republican EddieRispone for Governor. He will get your t\xe2\x80\xa6 t.co/WRsx8GlSdP'
"b'....We send our deepest condolences to the families and friends of those tragically lost, and we pray for the speed\xe2\x80\xa6 t.co/V4d7dDn6HG'"
"b'We continue to monitor the terrible events at Saugus High School in Santa Clarita, California through our ongoing c\xe2\x80\xa6 t.co/EfzRdbOvkn'"
b'Where\xe2\x80\x99s the Fake Whistleblower?'
"b'....that the House Democrats have done since she\xe2\x80\x99s become Speaker, other than chase Donald Trump.\xe2\x80\x9d This Impeachment\xe2\x80\xa6 t.co/p80sbKJ6ci'"
"b'....anywhere, so we\xe2\x80\x99ve now had 3 years of the Democrats chasing Donald Trump. Nancy Pelosi\xe2\x80\x99s worried about the Amer\xe2\x80\xa6 t.co/IsUpM0bVsw'"
b'DanHenninger WSJ: Nancy Pelosi had it right the first time when she did not want to go down the Impeachment path\xe2\x80\xa6 t.co/uI64avtp3L'
b'\xe2\x80\x9cThat hearing was about a policy dispute.\xe2\x80\x9d Robert Ray. \xe2\x80\x9cRegular people watching this cannot conclude that the Presi\xe2\x80\xa6 t.co/2AI80BU3m8'
b'\xe2\x80\x9cNeither one of the Democrat star witnesses at the Impeachment hearings could point out an impeachable offense. Tha\xe2\x80\xa6 t.co/jyyKeUkl4b'
b'Walmart announces great numbers. No impact from Tariffs (which are contributing $Billions to our Treasury). Inflati\xe2\x80\xa6 t.co/QreDGszf2V'
"b'Hit New Stock Market record again yesterday, the 20th time this year, with GREAT potential for the future. USA is w\xe2\x80\xa6 t.co/kidaZkYMUK'"
"b'RepRatcliffe asked the two \xe2\x80\x9cstar\xe2\x80\x9d witnesses, \xe2\x80\x9cwhere is the impeachable event in that call?\xe2\x80\x9d Both stared straight\xe2\x80\xa6 t.co/PGv9NDBf6W'"
"b'Wow! Was just told that my son\xe2\x80\x99s book, \xe2\x80\x9cTriggered,\xe2\x80\x9d is Number One on The New York Times Bestseller List. Congratulations Don!'"
b'President Zelensky sa\xe2\x80\xa6'
b'And President Trump was deeply skeptical of this cor\xe2\x80\xa6'
"b'During that time, we verified that President Zelensky was the real deal. t.co/TWJ\xe2\x80\xa6'"
b'\xe2\x80\x9cWelcome to year 4 of the ongoing Impeachment of President realDonaldTrump...If your Impeachment case\xe2\x80\xa6'
b'Thank you FranklinGraham. It is a time of \xe2\x80\x9cshame\xe2\x80\x9d for our Country. The Democrats know what they are doing is wrong! t.co/O32ybh04vc'
"b""The Dems' star witness just said he had no firs\xe2\x80\xa6"""
b'\xe2\x80\xa2 Never spoke to President Trump.\xe2\x80\xa2 Never spoke to Rudy Giuliani.\xe2\x80\xa2 Never spoke to Mick Mulvan\xe2\x80\xa6'
b'It\xe2\x80\x99s NOT about fairness...It\xe2\x80\x99s NOT about finding the truth for the American people...For Hou\xe2\x80\xa6'
b'Star witness admits he has no first-hand knowledge of t\xe2\x80\xa6'
b' Jim_Jordan t.co/djTTLkvNZo'
"b""We're not surprised.Schiff's impea\xe2\x80\xa6"""
b'Their obsession\xe2\x80\xa6'
b' - realDonaldTrump and Zelen\xe2\x80\xa6'
b'- Neither have any firsthand knowledge- Neither spoke to realDonal\xe2\x80\xa6'
"b'DevinNunes: ""After vowing publicly that impeachment requires bipartisan support, Democrats are pushing impeachment\xe2\x80\xa6'"
"b""He deliberately mislead the public about his office's\xe2\x80\xa6"""
b'W\xe2\x80\xa6'
"b""\xe2\x86\x92 Democrats are refusing access to important witnesses.\xe2\x86\x92 The President's legal counsel is not allowe\xe2\x80\xa6"""
b'- Call transcript shows zero link between aid and political\xe2\x80\xa6'
"b'But make no mistake, Democrats have been out to get the Presi\xe2\x80\xa6'"
b'READ THE TRANSCRIPT!'
b'NEVER TRUMPERS!'
"b'....any laws or did anything wrong, and they have to move away from quid pro quo because there was no quid, and the\xe2\x80\xa6 t.co/mFAufTPQBZ'"
"b'...the most powerful tool the legislative branch has, Impeachment, andamp; they\xe2\x80\x99ve turned it into a political cudgel, whi\xe2\x80\xa6 t.co/KBxjfaCgoE'"
b'\xe2\x80\x9cNancy Pelosi cares more about power than she does about principle. She did not want to go down this road. She real\xe2\x80\xa6 t.co/TsEw7G2SiO'
b'The Democrats have stacked the deck against President Trump and the Republicans. They have leaked out everything. SteveDoocy foxandfriends'
"b'\xe2\x80\x9cMillions of Americans will see what a partisan sham this whole thing is.\xe2\x80\x9d Rush Limbaugh foxandfriends Also, why\xe2\x80\xa6 t.co/M291UJuFJv'"
"b'....to hurt Donald Trump and we, the people that support him. The Left has never accepted the results of the 2016 E\xe2\x80\xa6 t.co/kkWiy9nG8a'"
"b'....This is a phony showtrial. There is zero due process, none. It is yet another fraudulent hoax conspiracy theory\xe2\x80\xa6 t.co/QlTDRrq4zG'"
"b'\xe2\x80\x9cThe circus is coming to town. The corrupt, compromised, coward andamp; congenital liar Adam Schiff Show on Capital Hill,\xe2\x80\xa6 t.co/awn8Cwz8mn'"
"b'\xe2\x80\x9cThis ridiculous Impeachment is a travesty, it\xe2\x80\x99s not an inquiry. Just read the transcript.\xe2\x80\x9d LouDobbs'"
"b'DACA recipients with arrest records: 53,792! That is a very large proportion of the total. LouDobbs Not good, but\xe2\x80\xa6 t.co/slMxe1I0u7'"
b'A total Impeachment Scam by the Do Nothing Democrats! t.co/aFTQe293JF'
"b'Many of the people in DACA, no longer very young, are far from \xe2\x80\x9cangels.\xe2\x80\x9d Some are very tough, hardened criminals. P\xe2\x80\xa6 t.co/YpBQiUk0vL'"
b'Economy is BOOMING. Seems set to have yet another record day!'
"b'I will be releasing the transcript of the first, and therefore more important, phone call with the Ukrainian President before week\xe2\x80\x99s end!'"
"b'....Ukrainian energy company, and more millions taken from China, and now reports of other companies and countries\xe2\x80\xa6 t.co/oAR0MfV5jT'"
"b'.....\xe2\x80\x9dno pressure\xe2\x80\x9d put on him to investigate Sleepy Joe Biden even though, as President, I have an \xe2\x80\x9cobligation\xe2\x80\x9d to\xe2\x80\xa6 t.co/WW6KRWFP3Q'"
"b'Why is such a focus put on 2nd and 3rd hand witnesses, many of whom are Never Trumpers, or whose lawyers are Never\xe2\x80\xa6 t.co/zEdiWY4L90'"
b'A great try by seanspicer. We are all proud of you!'
"b'\xe2\x80\x9cThis isn\xe2\x80\x99t about Ukraine. This isn\xe2\x80\x99t about Impeachment. This is about subverting Democracy!\xe2\x80\x9d BillOReilly So true,\xe2\x80\xa6 t.co/V1H4Ec2ox1'"
b'....want that to be an impeachable offense? Good luck with that!\xe2\x80\x9d JesseBWatters FoxNews'
"b'\xe2\x80\x9cThe President has until September 30th to give this aid to Ukraine. He gets it out on September 11th., 3 weeks bef\xe2\x80\xa6 t.co/ChZJwJek4X'"
"b'Schiff and the Dems have created this whole thing, they reverse engineer it. They\xe2\x80\x99ve been vowing to impeach for thr\xe2\x80\xa6 t.co/lbZkEHMQsu'"
"b'In order to continue being the most Transparent President in history, I will be releasing sometime this week the Tr\xe2\x80\xa6 t.co/lCkiVhV2zh'"
"b'Just like Schiff fabricated my phone call, he will fabricate the transcripts that he is making and releasing!'"
"b'Schiff is giving Republicans NO WITNESSES, NO LAWYER andamp; NO DUE PROCESS! It is a totally one sided Witch Hunt. This c\xe2\x80\xa6 t.co/mBug7fJP4v'"
b'Read the Transcript. It is PERFECT!'
b'To think I signed the Whistleblower Protection Act! t.co/OSmPPcRs7x'
b'Where is the Whistleblower who gave so much false information? Must testify along with Schiff and others!'
