"b'Gerry Baker of WSJatLarge \xe2\x80\x9cDo you think what you\xe2\x80\x99ve seen rises to the level of impeachment?\xe2\x80\x9d Ken Starr, Clinton S\xe2\x80\xa6 t.co/CCJKag9PRl'"
b'Sleepy Eyes Chuck Todd of \xe2\x80\x9cMeet the Press\xe2\x80\x9d had a total meltdown in his interview with highly reaspected Senator\xe2\x80\xa6 t.co/j0usm2hmAn'
"b'Join me at the Target Center in Minneapolis, Minnesota this Thursday, October 10th at 7:00pm! Tickets:\xe2\x80\xa6 t.co/Y0JKKtFtsk'"
"b'Good job, I must say, by Bob Woodward on \xe2\x80\x9cDeface the Nation.\xe2\x80\x9d The CBS no name host(ess), and other guest, Peter Bak\xe2\x80\xa6 t.co/bn0vwftqbI'"
b'What were they up to? Only by full disclosure can President realDonaldTrump adequately\xe2\x80\xa6'
b't.co/LpE7y2bVFb'
b'\xe2\x80\x9cThat the Attorney General is holding meetings with your countr\xe2\x80\xa6'
b'Democrat lawyer is same for both Whistleblowers? All support Obama and Crooked Hillary. Witch Hunt! t.co/KL78g24AXx'
b'Growing up I went from foster house to foster house andamp; i never thought I would be at the Whit\xe2\x80\xa6'
b'Romney begged President Trump to endorse him in 2012 andamp; now he\xe2\x80\x99s always attacking Trump. UNLOYAL!\xe2\x80\xa6'
b'DRAIN THE SWAMP!'
"b'Will be in Minnesota on Thursday night. Massive response, crowd and enthusiasm (actually, all over the Country) wil\xe2\x80\xa6 t.co/4Im94qqPpY'"
b't.co/Xsk50hrvvW'
b't.co/Q6LzFFTLyX'
"b'Going to Louisiana on Friday night for a big Republican Rally. Keep Democrat Governor Edwards under 50%, force a ru\xe2\x80\xa6 t.co/rtbufGufk9'"
"b'....And by the way, I would LOVE running against 1% Joe Biden - I just don\xe2\x80\x99t think it\xe2\x80\x99s going to happen. Sleepy Joe\xe2\x80\xa6 t.co/vow8V54nrG'"
"b'The Biden family was PAID OFF, pure and simple! The fake news must stop making excuses for something that is totall\xe2\x80\xa6 t.co/hX8ljpFBHS'"
b'....and separately got 1.5 Billion Dollars from China despite no experience and for no apparent reason. There is NO\xe2\x80\xa6 t.co/gXuhg5s342'
b'It is INCREDIBLE to watch and read the Fake News and how they pull out all stops to protect Sleepy Joe Biden and hi\xe2\x80\xa6 t.co/q1NjVqTidG'
"b'The Democrats are lucky that they don\xe2\x80\x99t have any Mitt Romney types. They may be lousy politicians, with really bad\xe2\x80\xa6 t.co/r3gjpIhMj5'"
b'95% Approval Rating in Republican Party. Thank you!'
b' We\xe2\x80\x99re DOUBLE where President Obama was at this point in his re-election. Ameri\xe2\x80\xa6'
b'Unemployment for Hispanic and African-Americans\xe2\x80\xa6'
b'The Do Nothing Democrats are being exposed! t.co/Z5G5oEQOqs'
b'The great Scam is being revealed! t.co/Ny429UTVUn'
b't.co/Pwv653dFcA\xe2\x80\xa6'
b't.co/uElgSLSoJ8'
b't.co/UBsZoZb20g'
b't.co/F84WZ5LveS'
"b'The first so-called second hand information \xe2\x80\x9cWhistleblower\xe2\x80\x9d got my phone conversation almost completely wrong, so n\xe2\x80\xa6 t.co/Sv4JF23pd6'"
"b'\xe2\x80\x9cPresident Trump would be negligent if he did not bring this matter, Biden, up. If the V.P. of the U.S. is self enr\xe2\x80\xa6 t.co/bWgV7oZZp4'"
b'Schiff and the Do Nothing Dems have lost all credibility...but the corrupt Media is working hard to keep them in th\xe2\x80\xa6 t.co/J61YyYdJLq'
"b'Mitt, get off the stage, you\xe2\x80\x99ve had your turn (twice)! t.co/zz6TA6XoGe'"
"b""It's because the results keep coming. And they're\xe2\x80\xa6"""
b'Schiff\xe2\x80\x99s Record:- Collus\xe2\x80\xa6'
"b'So Crooked Hillary Clinton can delete and acid wash 33,000 emails AFTER getting a Subpoena from the United States C\xe2\x80\xa6 t.co/Fvg6ykqSgR'"
"b'No Kevin, Jeff Flake is better! t.co/IyENBffEjp'"
"b'I\xe2\x80\x99m hearing that the Great People of Utah are considering their vote for their Pompous Senator, Mitt Romney, to be\xe2\x80\xa6 t.co/EHjEsJ47ql'"
"b'Not only are the Do Nothing Democrats interfering in the 2020 Election, but they are continuing to interfere in the\xe2\x80\xa6 t.co/yoKvnTXLLp'"
"b'Mitt Romney never knew how to win. He is a pompous \xe2\x80\x9cass\xe2\x80\x9d who has been fighting me from the beginning, except when h\xe2\x80\xa6 t.co/DseOZc1cww'"
b'Somebody please wake up Mitt Romney and tell him that my conversation with the Ukrainian President was a congenial\xe2\x80\xa6 t.co/ucyCacQC6X'
"b'The so-called Whistleblower\xe2\x80\x99s account of my perfect phone call is \xe2\x80\x9cway off,\xe2\x80\x9d not even close. Schiff and Pelosi neve\xe2\x80\xa6 t.co/PfrOdjiuhK'"
b'The Media is \xe2\x80\x9cFixed\xe2\x80\x9d and Corrupt. It bears no relationship to the truth. The nytimes andamp; washingtonpost are pure fi\xe2\x80\xa6 t.co/'
b'Too bad! t.co/UFHAIlhoCe'
b't.co/N3FaZ5UVI0'
b'Thank you robertjeffress! t.co/GW4hFDbIpj'
b'\xe2\x80\x9cReport: \xe2\x80\x98Whistleblower\xe2\x80\x99 Never Disclosed Contact with House Intel Panel to Inspector General\xe2\x80\x9dt.co/Pmhqdgmxba'
b'GREAT BOOK! t.co/LrRr1xhS0d'
"b""\xe2\x80\x9cPelosi Blatantly Lies During GMA Interview About Schiff's Reading of Ukraine Transcript\xe2\x80\x9dt.co/a6HEwMnEmU"""
b'https\xe2\x80\xa6'
b'Where is the LameStream Media on this? t.co/Qaak5dvyKC'
b'Thanks Jim. Would be great to just run our Country! t.co/8GcmgQaVYK'
b'\xe2\x80\x9cEx-Envoy testified Ukraine (or the President of Ukraine) never raised Quid Pro Quo concerns with him: source.\xe2\x80\x9d\xe2\x80\xa6 t.co/TiaOFDWVgL'
"b'....of Ukraine, and cannot find any reason to charge the President with high crimes andamp; misdemeanors. This is just a\xe2\x80\xa6 t.co/rhfjaUcueQ'"
"b'\xe2\x80\x9cIt isn\xe2\x80\x99t often I get angry at the dirty politics of the Democrats in Congress, but this time I am enraged and hope\xe2\x80\xa6 t.co/P74RRbmUc2'"
"b'Along with Pelosi and her boss AOC, the Do Nothing Democrat \xe2\x80\x9cleader.\xe2\x80\x9d t.co/PILyE1c220'"
"b'Join me at the Target Center in Minneapolis, Minnesota next Thursday, October 10th at 7:00pm! Tickets:\xe2\x80\xa6 t.co/QAW29tr775'"
"b'My daughter Ivanka will be on trish_regan tonight on FoxBusiness at 8:00 P.M., following the great LouDobbs at 7:00. Enjoy!'"
"b'....it to Congress, and the American people, as though it was the statement of the President of the United States,\xe2\x80\xa6 t.co/WCmY5dWgvP'"
"b'\xe2\x80\x9cAdam Schiff\xe2\x80\x99s connection to the Whistleblower is coming to light.\xe2\x80\x9d FoxNews These facts, and others, make it impo\xe2\x80\xa6 t.co/zkUegM6iwp'"
b'LYIN\xe2\x80\x99 SHIFTY SCHIFF! t.co/vSZgFz9fIS'
b'\xe2\x80\x9cWhen your making an unsubstantiated charge that the President of the United States is making a request having to d\xe2\x80\xa6 t.co/UKlifVbnxs'
b't.co/KYEzdMjl2k'
b'I have just officially nominated Poland for entry into the Visa Waiver Program. With this decades long-awaited anno\xe2\x80\xa6 t.co/hfSREYk5H6'
"b'At the request of SenThomTillis, I have declared a major disaster for the Great State of North Carolina to help wi\xe2\x80\xa6 t.co/XFY4AXWPpJ'"
"b'Under my Administration, Medicare Advantage premiums next year will be their lowest in the last 13 years. We are pr\xe2\x80\xa6 t.co/rQzE63uEna'"
"b'WOW, this is big stuff! t.co/H12yxMfua3'"
b'\xe2\x80\x9cI think it\xe2\x80\x99s outrages that a Whistleblower is a CIA Agent.\xe2\x80\x9d Ed Rollins FoxNews'
"b'\xe2\x80\x9cThe witness was asked at least 20 times, and there definitely was no Quid Pro Quo.\xe2\x80\x9d RepMarkMeadows FoxNews The\xe2\x80\xa6 t.co/vcC2EgMUSM'"
"b'\xe2\x80\x9cWhen your making an unsubstantiated statement that the President is making a claim having to do with quid pro quo,\xe2\x80\xa6 t.co/gC5OaMLlMP'"
b't.co/uYyoaCXuqu'
"b'The Whistleblower, who had the facts wrong about the phone call, reached out, and more, to the Democrat controlled\xe2\x80\xa6 t.co/NS6a1ESPj6'"
"b'Breaking News: Unemployment Rate, at 3.5%, drops to a 50 YEAR LOW. Wow America, lets impeach your President (even t\xe2\x80\xa6 t.co/zcxiZje0Pc'"
"b'As President I have an obligation to end CORRUPTION, even if that means requesting the help of a foreign country or\xe2\x80\xa6 t.co/VtIoWfGv91'"
"b'The Washington Times, \xe2\x80\x9cUkraine envoy blows \xe2\x80\x98massive hole\xe2\x80\x99 into Democrat accusations. Republicans at hearing find no\xe2\x80\xa6 t.co/WsIropdsfT'"
"b'Nancy Pelosi today, on GMA, actually said that Adam Schiffty Schiff didn\xe2\x80\x99t fabricate my words in a major speech be\xe2\x80\xa6 t.co/itjJ4LIO0f'"
b'\xe2\x80\x9cThey (Do Nothing Dems) are trying to nullify an election...\xe2\x80\x9d Joe diGenova t.co/0a7Apd4kUO'
"b'This isn\xe2\x80\x99t about a Campaign, this is about Corruption on a massive scale! t.co/DOCvfM8eqi'"
"b'We are simultaneously fighting the Fake News Media and their partner, the Democrat Party. Always tough to beat the\xe2\x80\xa6 t.co/FUz1WpnpNY'"
b'Great job Jim! t.co/JMuE3pRWmk'
b'AOC is a Wack Job! t.co/LU3hIeek0c'
b'The Do Nothing Democrats don\xe2\x80\x99t have time to get it done! t.co/2cwyMtT3Gu'
b'Another big loss for the Do Nothing Dems! t.co/Pwp7dYdF8e'
"b'As the President of the United States, I have an absolute right, perhaps even a duty, to investigate, or have inves\xe2\x80\xa6 t.co/X8NmXJ5ey7'"
"b'""...blowing MASSIVE holes inside of the theory, the narrative, that Chairman Schiff has been providing to the publi\xe2\x80\xa6 t.co/aHzfNPkOJU'"
"b'\xe2\x80\x9cIt was just a congenial phone call, but its become so big. I\xe2\x80\x99ve never seen the Media work so hard with so little.\xe2\x80\x9d\xe2\x80\xa6 t.co/zGZQFBEVZU'"
"b'Thank you JennaEllisRives, really well done! t.co/N2VsQ8y0rb'"
b'DRAIN THE SWAMP! t.co/N3FaZ5Dkjq'
b'\xe2\x80\x9cThis is yet again an example of Democrats projecting THEIR criminal acts on President Trump. President Trump is an\xe2\x80\xa6 t.co/L20wvoXD9x'
b'\xe2\x80\x9cTrump Fundraising Haul Shows Impeachment Backfiring on Dems\xe2\x80\x9d t.co/LM1hTQX0lY'
b'There wasn\xe2\x80\x99t ANYTHING said wrong in my conversation with the Ukrainian President. This is a Democrat Scam!'
b'Great time at The Villages in Florida today. Sorry we couldn\xe2\x80\x99t get everybody in. I will be back soon! t.co/ia87A0sEue'
b'ELECTION INTERFERENCE!'
"b'95% Approval Rating in the Republican Party, and record setting fundraising that has taken place over the past two weeks. Thank you!'"
"b'Leader McCarthy, we look forward to you soon becoming Speaker of the House. The Do Nothing Dems don\xe2\x80\x99t have a chance! t.co/uWPdGJg99F'"
b't.co/2TfEyp1dHX'
"b'Fake News, just like the snakes and gators in the moat. The Media is deranged, they have lost their minds! t.co/rk26SXj4il'"
b'\xe2\x80\x9cSchiff is basically the Jussie Smollett of Congres\xe2\x80\xa6'
b'Schiff is a lowlife who should resign (at least!). t.co/nGp9aFP3rX'
b'Schiff is a lying disaster for our Country. He should resign! t.co/ytwEy5NasJ'
b'The Republican Party has never had such support! t.co/P6GHgBv3v9'
b'Book is doing really well. A study in unfairness to a potentially great Justice! t.co/i6GwghuEsU'
b'Thank you Hugh! t.co/So77AMeK5u'
b'A great book by a brilliant author. Buy it now! t.co/L8XC5Nnj4N'
b'Great job Richard! t.co/Uv8xgZPshu'
b'Keep up the great work Kellie! t.co/PcAnK009EW'
b'\xe2\x80\x9cThe Ukraine controversy continues this morning as new documents obtained by FoxNews show that a former Ukrainian\xe2\x80\xa6 t.co/3r7ERtRaou'
"b'The U.S. won a $7.5 Billion award from the World Trade Organization against the European Union, who has for many ye\xe2\x80\xa6 t.co/SG1RNogrpB'"
"b'Since the election:\xe2\xad\x90\xef\xb8\x8f Employment \xe2\xac\x86\xef\xb8\x8f by 6.4% = 774,000 NEW jobs \xe2\xad\x90\xef\xb8\x8fManufacturing employment\xe2\x80\xa6'"
b'DEMOCRATS WANT TO STEAL THE ELECTION! t.co/hz6fWLId3L'
"b'....He loves our Military and supports our Vets! Democrat Jim Hood will never give us his vote, is anti-Trump and p\xe2\x80\xa6 t.co/KitOSDLnHh'"
"b'Mississippi, there is a VERY important election for Governor on November 5th. I need you to Get Out and Vote for ou\xe2\x80\xa6 t.co/tWLM1SYM2d'"
b'LOOK AT THIS PHOTOGRAPH! t.co/QQYTqG4KTt'
"b'\xe2\x80\x9cSchiff, House Intel Chairman, Got Early Account of Whistle-Blower\xe2\x80\x99s Accusations\xe2\x80\x9d SCHIFF IS A FRAUD!\xe2\x80\xa6 t.co/eplnv1eLIF'"
"b'The Do Nothing Democrats should be focused on building up our Country, not wasting everyone\xe2\x80\x99s time and energy on BU\xe2\x80\xa6 t.co/kpxVx4b2Gy'"
"b'Adam Schiff should only be so lucky to have the brains, honor and strength of Secretary of State Mike Pompeo. For a\xe2\x80\xa6 t.co/U10wg273nt'"
b'Democrats are trying to undo the Election regardless of FACTS! t.co/cQ3B1bGD4L'
b'Nancy Pelosi just said that she is interested in lowering prescription drug prices andamp; working on the desperately nee\xe2\x80\xa6 t.co/NJLUNwWCVn'
"b'All of this impeachment nonsense, which is going nowhere, is driving the Stock Market, and your 401K\xe2\x80\x99s, down. But t\xe2\x80\xa6 t.co/TzqQ6FDvF8'"
"b'Now the press is trying to sell the fact that I wanted a Moat stuffed with alligators and snakes, with an electrifi\xe2\x80\xa6 t.co/vzjHlA3wMe'"
b'\xe2\x80\x9cNancy Pelosi and the Democrats haven\xe2\x80\x99t met the standards of impeachment. They have to be very careful here.\xe2\x80\x9d Jeanne Zaino. FoxNews'
b'All the Do Nothing Democrats are focused on is Impeaching the President for having a very good conversation with th\xe2\x80\xa6 t.co/n1uFNVlDPG'
"b'Congressman Adam Schiff should resign for the Crime of, after reading a transcript of my conversation with the Pres\xe2\x80\xa6 t.co/SWi7gOq09g'"
b'http\xe2\x80\xa6'
"b'Massive sections of The Wall are being built at our Southern Border. It is going up rapidly, and built to the highe\xe2\x80\xa6 t.co/i3c6PpMi3X'"
"b'I won the right to be a presidential candidate in California, in a major Court decision handed down yesterday. It w\xe2\x80\xa6 t.co/CyuPpTo0kS'"
b'Louisiana Republicans must go out and vote REPUBLICAN in your Governor\xe2\x80\x99s race. A Republican will win if you can for\xe2\x80\xa6 t.co/oO14xgxzQP'
b'The Greatest Witch Hunt in the history of our Country! t.co/7moLU6UTcE'
"b'....People, their VOTE, their Freedoms, their Second Amendment, Religion, Military, Border Wall, and their God-give\xe2\x80\xa6 t.co/LWjvAwYOZg'"
"b'As I learn more and more each day, I am coming to the conclusion that what is taking place is not an impeachment, i\xe2\x80\xa6 t.co/8tLcBuk5RO'"
"b'....a Nancy Pelosi/Chuck Schumer Democrat (John Bel Edwards), who does nothing but stymie all of the things we are\xe2\x80\xa6 t.co/yUuvrddzKV'"
"b'REPUBLICANS of Louisiana, it is really important for you to go out and vote on October 12th for either Eddie Rispon\xe2\x80\xa6 t.co/knvy9ZcDNB'"
b'Why isn\xe2\x80\x99t Congressman Adam Schiff being brought up on charges for fraudulently making up a statement and reading it\xe2\x80\xa6 t.co/UZQ6UF8FV1'
"b'As I predicted, Jay Powell and the Federal Reserve have allowed the Dollar to get so strong, especially relative to\xe2\x80\xa6 t.co/9Y563f6Dpg'"
"b'....the Whistleblower, and also the person who gave all of the false information to him. This is simply about a pho\xe2\x80\xa6 t.co/4DvAkHxisy'"
"b'So if the so-called \xe2\x80\x9cWhistleblower\xe2\x80\x9d has all second hand information, and almost everything he has said about my \xe2\x80\x9cpe\xe2\x80\xa6 t.co/DNGvlSx1i5'"
"b'\xe2\x80\x9cThe congratulatory phone call with the Ukrainian President was PERFECT, unless you heard Liddle\xe2\x80\x99 Adam Schiff\xe2\x80\x99s fra\xe2\x80\xa6 t.co/macxKMW8T5'"
b't.co/dOta1Z9gtZ'
"b'\xe2\x80\x9cUnder President Trump\xe2\x80\x99s leadership, 774,4\xe2\x80\xa6'"
b'That\xe2\x80\x99s what realDonaldTrump has done since he was elected.All\xe2\x80\xa6'
b'Congratulations to President Xi and the Chinese people on the 70th Anniversary of the People\xe2\x80\x99s Republic of China!'
"b'Great job, just in time! t.co/KMUXtO8IYz'"
"b'Just last week, they pressu\xe2\x80\xa6'"
"b'You cannot judge my Stock Market performance since the Inauguration, which was very good, but only from the day aft\xe2\x80\xa6 t.co/sUMCWsStoO'"
b'The Corrupt Media refuses to cover this! t.co/JIiOE2a2JF'
"b'Today, I was proud to sign the Autism CARES Bill! We support research for Americans with Autism and their families.\xe2\x80\xa6 t.co/DrbSSEzipM'"
b't.co/DJLYoma7KB'
b'THANK YOU! t.co/zqbTTlbGmp'
"b'My great friend, RepMarkMeadows, has been an EXCELLENT Chairman of the House FreedomCaucus, which has been a trem\xe2\x80\xa6 t.co/P7WAw36Cwf'"
"b'BIG NEWS by Hyundai, Kia, and Aptiv on a 4 BILLION DOLLAR joint venture to develop autonomous driving technologi\xe2\x80\xa6 t.co/TIYsoMNiTa'"
b'Great news! Apple announced that it is building its new Mac Pro in Texas. This means hundreds of American jobs in\xe2\x80\xa6 t.co/p6lpqWd1YX'
b'Navistar will be building a new 250 MILLION DOLLAR truck factory in San Antonio with 600 new jobs. Congratulations\xe2\x80\xa6 t.co/5U4MWzxKkz'
"b'It was my Great Honor to attend this mornings Welcome Ceremony for the 20th Chairman of the Joint Chiefs of Staff,\xe2\x80\xa6 t.co/Uydq6PnX1A'"
b'The Fake News Media wants to stay as far away as possible from the Ukraine and China deals made by the Bidens. A Co\xe2\x80\xa6 t.co/sMfEkcSkzX'
"b'Very simple! I was looking for Corruption and also why Germany, France and others in the European Union don\xe2\x80\x99t do mo\xe2\x80\xa6 t.co/QYCX1IYMgj'"
b'....they made this whole thing up. Impeachment is also a pre-emptive strike for what they think is coming on the Ob\xe2\x80\xa6 t.co/jx8inhDLiS'
"b'\xe2\x80\x9cPresident Trump\xe2\x80\x99s Job Approval Numbers have just reached the highest level since his Inauguration, around 50%, and\xe2\x80\xa6 t.co/'"
b'WHO CHANGED THE LONG STANDING WHISTLEBLOWER RULES JUST BEFORE SUBMITTAL OF THE FAKE WHISTLEBLOWER REPO'
"b'Again, the President of Ukraine said there was NO (ZERO) PRESSURE PUT ON HIM BY ME. Case closed!'"
"b'....place in TRADE, it\xe2\x80\x99s taking shape in Military Competition.\xe2\x80\x9d Johnathan Ward, author and China expert. We are win\xe2\x80\xa6 t.co/zBa01K39Ot'"
"b'\xe2\x80\x9cAfter many years, the United States is finally waking up to Beijing\xe2\x80\x99s plans and ambitions to pass us as the domina\xe2\x80\xa6 t.co/lsUpDLZZv5'"
"b'Rep. Adam Schiff illegally made up a FAKE andamp; terrible statement, pretended it to be mine as the most important part\xe2\x80\xa6 t.co/zRmd9IRWOX'"
"b'The Fake Whistleblower complaint is not holding up. It is mostly about the call to the Ukrainian President which, i\xe2\x80\xa6 t.co/2FIn80dk3W'"
b'\xe2\x80\x9cChina Trade Turmoil: China Urging a CALM AND RATIONAL Solution.\xe2\x80\x9d MariaBartiromo FoxBusiness China is doing very\xe2\x80\xa6 t.co/YQ7mkkvTk6'
b'The Greatest Witch Hunt in the history of our Country!'
"b""1. The whistleblower wasn't on the call.2. The IG didn't read the transcript be\xe2\x80\xa6"""
"b'....If the Democrats are successful in removing the President from office (which they will never be), it will cause\xe2\x80\xa6 t.co/3f1ERjlDXw'"
"b'....Election, and negate the votes of millions of Evangelicals in the process. They know the only Impeachable offen\xe2\x80\xa6 t.co/VOkNCRcpbp'"
b'....rid of Donald J. Trump - And the Democrats don\xe2\x80\x99t care if they burn down and destroy this nation in the process.\xe2\x80\xa6 t.co/zgEZt8uGC5'
b'\xe2\x80\x9cNancy Pelosi and the Democrats can\xe2\x80\x99t put down the Impeachment match. They know they couldn\xe2\x80\x99t beat him in 2016 agai\xe2\x80\xa6 t.co/SbaHR0GnNA'
"b'\xe2\x80\x9cState Department has stepped up Hillary Clinton Email probe.\xe2\x80\x9d foxandfriends You mean the 33,000 Emails that she\xe2\x80\xa6 t.co/yi4ovuJvir'"
"b'....we are going to have an Election very shortly.\xe2\x80\x9d Rep. Jeff Van Drew, Democrat of New Jersey. foxandfriends Tha\xe2\x80\xa6 t.co/sz2EQ8pd3v'"
"b'\xe2\x80\x9cAll that\xe2\x80\x99s swirling around us now is Impeachment. We talk about it day and night, it\xe2\x80\x99s what\xe2\x80\x99s on the news, there i\xe2\x80\xa6 t.co/n3BeIjW5fc'"
"b'These Radical Left, Do Nothing Democrats, are doing great harm to our Country. They are lying andamp; cheating like never\xe2\x80\xa6 t.co/jKOpEGaCQ1'"
"b'....In addition, I want to meet not only my accuser, who presented SECOND andamp; THIRD HAND INFORMATION, but also the pe\xe2\x80\xa6 t.co/QZXfd2kOtu'"
b'His lies were made in perhaps the most blatant and sinister manner ever seen in the great Chamber. He wrote down an\xe2\x80\xa6 t.co/DUMJxtHb9B'
"b'Like every American, I deserve to meet my accuser, especially when this accuser, the so-called \xe2\x80\x9cWhistleblower,\xe2\x80\x9d rep\xe2\x80\xa6 t.co/kD5WIu8A3E'"
"b'Wishing a Happy New Year to all of those celebrating Rosh Hashanah in America, Israel, and around the World! t.co/fpyewMEZuI'"
b't.co/vuFsgolfVO'
b'Investigating Corruption is correct! t.co/kqn3pOZfoE'
"b'Still love ya, Ed\xe2\x80\xa6'"
b'So great Mark! t.co/GbwEnkFmwe'
b't.co/w6o2JkaxZ7'
b'Will happen to all of those seeking unlawful impeachment in 50 Trump type Districts. We will win big! t.co/aX5l9WrP1z'
b'\xe2\x80\x9cThese are Trumped-Up Charges.\xe2\x80\x9d PeteHegseth foxandfriends'
b'The Fake News doesn\xe2\x80\x99t dare mention the corrupt Democrats! t.co/JIiOE2a2JF'
b't.co/byF\xe2\x80\xa6'
b't.co/0bJ518COnl\xe2\x80\xa6'
b't.co/pBdQzqhVGx t.co/w\xe2\x80\xa6'
b't.co/4zbJKTus9t t.co/iJhNTlzHqr'
b't.co/Mw4XOcGhN\xe2\x80\xa6'
b't.co/ttovM9t3HG t.c\xe2\x80\xa6'
b't.co/W8T3i7C11a t.co/8lyE04vxeY'
b't.co/boz6nrA5ho h\xe2\x80\xa6'
b't.co/43ueMP8zNI http\xe2\x80\xa6'
b't.co/v0Na0XEOHu t.co/lkOIgHK4MH'
b't.co/58DttYHIR4 t.co/dfQJypd3W2'
b't.co/vvEDqbX8e7 t.co/SPIxLgKHXz'
b't.co/hkW3svtVU4 t.co/mPM5PIVttq'
b't.co/XtcdiSWlHF\xe2\x80\xa6'
b't.co/DTWq56UtvZ\xe2\x80\xa6'
b't.co/6ILVFbVIKz t.co/W9lYQsifHJ'
b't.co/vwEg3FEmO5 t.co/\xe2\x80\xa6'
b't.co/5bv3IKRaN0 t.co/8AKlzGV\xe2\x80\xa6'
b't.co/FDa6QxAHEo t.co/82HY8Dv2rU'
b't.co/fwMnnRl9pO t.co\xe2\x80\xa6'
b't.co/5JO4Ugwm34 t.co/daNPBhQ\xe2\x80\xa6'
b't.co/j8H1ZJBpX5 t.c\xe2\x80\xa6'
b'The only people that don\xe2\x80\x99t like my conversation with the new Ukrainian President are those that heard Rep. Adam Sch\xe2\x80\xa6 t.co/IaGnPLupMB'
"b'It is disgraceful what the Do Nothing Democrats are doing (the Impeachment Scam), but it is also disgraceful what t\xe2\x80\xa6 t.co/88CYIDT9fH'"
"b'WOW, they got caught. End the Witch Hunt now! t.co/A5k3u9Rg3D'"
b'....fraudulently and illegally inserted his made up andamp; twisted words into my call with the Ukrainian President to ma\xe2\x80\xa6 t.co/sOwQvcTyL1'
b'The Whistleblower\xe2\x80\x99s complaint is completely different and at odds from my actual conversation with the new Presiden\xe2\x80\xa6 t.co/pZAgEbwdbK'
"b'....The conversation with the new and very good Ukraine President, who told the Fake News, at the United Nations, t\xe2\x80\xa6 t.co/hojzznMqim'"
"b'How do you impeach a President who has created the greatest Economy in the history of our Country, entirely rebuilt\xe2\x80\xa6 t.co/6HFLjAPjrr'"
"b'They are trying to stop ME, because I am fighting for YOU! t.co/xiw4jtjkNl'"
b'KEEP AMERICA GREAT!'
b'MAKE AMERICA GREAT AGAIN!'
b'PRESIDENTIAL HARASSMENT!'
"b'Can you imagine if these Do Nothing Democrat Savages, people like Nadler, Schiff, AOC Plus 3, and many more, had a\xe2\x80\xa6 t.co/NSEozjOBNb'"
"b""She promised she'd work with realDonaldTru\xe2\x80\xa6"""
b'Voter I.D. is the best way. Go for it Doug! t.co/D0HtwP2u59'
b'Thank you to General McMaster. Just more Fake News! t.co/kVR6Q0Qu6a'
b't.co/SzT60K4sW3'
b'Dozens of House Dems campaigned\xe2\x80\xa6'
b'I AM DRAINING THE SWAMP! t.co/U7WxKrO6Kx'
"b'If that perfect phone call with the President of Ukraine Isn\xe2\x80\x99t considered appropriate, then no future President can\xe2\x80\xa6 t.co/QfHzQrLk7J'"
"b'Sounding more and more like the so-called Whistleblower isn\xe2\x80\x99t a Whistleblower at all. In addition, all second hand\xe2\x80\xa6 t.co/MAnthxbKYt'"
b'The Democrats are now to be known as the DO NOTHING PA'
b'Rep. Adam Schiff totally made up my conversation with Ukraine President and read it to Congress and Millions. He mu\xe2\x80\xa6 t.co/NODwsXNb79'
b'\xe2\x80\x9cIT WAS A PERFECT CONVERSATION WITH UKRAINE PRESIDENT!\xe2\x80\x9d'
"b'Iran wanted me to lift the sanctions imposed on them in order to meet. I said, of course, NO!'"
"b'...sound horrible, and me sound guilty. HE WAS DESPERATE AND HE GOT CAUGHT. Adam Schiff therefore lied to Congress\xe2\x80\xa6 t.co/IS2RyR0XZC'"
"b'Rep. Adam Schiff fraudulently read to Congress, with millions of people watching, a version of my conversation with\xe2\x80\xa6 t.co/gxbYFvD2uD'"
"b'.....nice call with with the new President of Ukraine, it could not have been better or more honorable, and the Fak\xe2\x80\xa6 t.co/dGTsZUaypI'"
"b'Obama loving (wrote Obama book) Peter Baker of the Failing New York Times, married to an even bigger Trump Hater th\xe2\x80\xa6 t.co/8Yq8h5xhDq'"
"b'To show you how dishonest the LameStream Media is, I used the word Liddle\xe2\x80\x99, not Liddle, in discribing Corrupt Congr\xe2\x80\xa6 t.co/guKxTAXhvR'"
b't.co/nnZWgUDKMT'
b'So many lies by Sleepy Joe and the Do Nothing Democrats! t.co/MY1zkMvFQW'
b't.co/ck4ZWu3F2N'
b't.co/6ggjWb5uJZ'
b't.co/TAJLOrpFZe'
b'Will be a GREAT and very accurate show tonight by seanhannity on foxnews (9:00 PM). Will play my full statement from Air Force One!'
b'The President of Ukraine said that he was NOT pressured by me to do anything wrong. Can\xe2\x80\x99t have better testimony tha\xe2\x80\xa6 t.co/t9TAX3Ne86'
b'No one has done more behind the scenes for STRONG BORDER SECURITY than SenCapito. Her bill passed Committee today\xe2\x80\xa6 t.co/r7L8mEwPX5'
"b'Congratulations to my friend SenShelby, our powerful Appropriations Chairman, for his hard work on many strong bil\xe2\x80\xa6 t.co/iJugvD2Ota'"
"b'Liddle\xe2\x80\x99 Adam Schiff, who has worked unsuccessfully for 3 years to hurt the Republican Party and President, has just\xe2\x80\xa6 t.co/oY9z9ecAHE'"
b'Adam Schiff has zero credibility. Another fantasy to hurt the Republican Party!'
